{
  "order_id": "550e8400-e29b-41d4-a716-446655440000",
  "intent_id": "550e8400-e29b-41d4-a716-446655440001",
  "account_id": "xxxxxxxxxxxxxxxxxxxxxxxxxxxxxxxxxxxxxxxxxxxxxxxxxxxxxxxxxxxxxxxxxxxxxxxxxxxxxxxxxxxxxxxxxxxxxxxxxxxxxxxxxxxxxxxxxxxxxxxxxxxxxxxx",
  "instrument_id": "xxxxxxxxxxxxxxxxxxxxxxxxxxxxxxxxxxxxxxxxxxxxxxxxxxxxxxxxxxxxxxxx",
  "side": "BUY",
  "position_effect": "AUTO",
  "order_type": "LIMIT",
  "quantity": 100,
  "limit_price": "10.01",
  "time_in_force": "DAY",
  "owner_strategy_id": "xxxxxxxxxxxxxxxxxxxxxxxxxxxxxxxxxxxxxxxxxxxxxxxxxxxxxxxxxxxxxxxxxxxxxxxxxxxxxxxxxxxxxxxxxxxxxxxxxxxxxxxxxxxxxxxxxxxxxxxxxxxxxxxx",
  "owner_strategy_version": "xxxxxxxxxxxxxxxxxxxxxxxxxxxxxxxxxxxxxxxxxxxxxxxxxxxxxxxxxxxxxxxx",
  "registered_at": "2026-07-02T02:00:00Z"
}
